{
  "version": 1,
  "camera_id": "cam_01",
  "detector_adapter": "synthetic_detector",
  "frames": [
    {
      "frame_id": "frame_0001",
      "occurred_at": "2026-08-03T01:02:03+00:00",
      "detections": [
        {
          "detection_id": "det_0001_person",
          "label": "person",
          "confidence": 0.91,
          "bbox_xyxy": [0.1, 0.2, 0.3, 0.8]
        },
        {
          "detection_id": "det_0001_sports_ball",
          "label": "sports ball",
          "confidence": 0.82,
          "bbox_xyxy": [0.7, 0.6, 0.8, 0.75]
        }
      ]
    },
    {
      "frame_id": "frame_0002",
      "occurred_at": "2026-08-03T01:02:04+00:00",
      "detections": [
        {
          "detection_id": "det_0002_person",
          "label": "person",
          "confidence": 0.93,
          "bbox_xyxy": [0.12, 0.2, 0.32, 0.8]
        },
        {
          "detection_id": "det_0002_sports_ball",
          "label": "sports ball",
          "confidence": 0.84,
          "bbox_xyxy": [0.68, 0.6, 0.78, 0.75]
        }
      ]
    }
  ]
}
